titular|encabezado|fecha|cuerpo|imagen
El poderoso armamento que le incautaron a banda criminal que genera zozobra en Manrique|"
Las autoridades avanzan en ofensiva contra estructura que opera en el nororiente de Medellín."|25 de agosto 2023, 10:54 A. M.|"Un operativo de allanamiento en una vivienda del barrio Las Granjas de Manrique, al nororiente de Medellín, permitió a las autoridades encontrar un poderoso armamento que pertenecería a una estructura criminal de la zona. (Lo invitamos a leer: Este es el cartel de los alias más buscados en comuna Manrique de Medellín)Se trata de la misma banda que en los últimos días causó zozobra en las calles de Manrique por el asesinato de tres personas en medio de una confrontación armada con otra estructura. El operativo —adelantado por la Fiscalía General de la Nación y la Policía Metropolitana del Valle de Aburrá este 23 de agosto— dejó dos personas capturadas, un hombre y una mujer, por el delito de tráfico, fabricación y porte de armas de fuego de uso civil y militar. Las autoridades incautaron, además, un fusil M4 calibre 5.56, una subametralladora mini Ingram calibre 9 milímetros, un revólver calibre 38, una pistola, 280 cartuchos para armamento de medio y largo alcance, 16 proveedores y un chaleco balístico.(Le puede interesar: Plan de choque en seguridad deja los primeros resultados en Medellín y Antioquia)Según la Fiscalía, el armamento habría sido utilizado por la estructura para cometer actividades criminales y sostener enfrentamientos con otras organizaciones que operan en Manrique y Aranjuez.  ""Se dio la instrucción a los fiscales del grupo de homicidios de la Fiscalía para que se realice un cotejo balístico de estas armas para cruzarlos con los homicidios que hemos tenido en el sector de Manrique"", apuntó Milena Amado, directora de Fiscalías Medellín. En la última semana, además, la Policía Metropolitana capturó a nueve personas en flagrancia por el delito de tráfico, fabricación o porte de estupefacientes, tras siete diligencias de registro y allanamiento que también se adelantaron en las comunas de Manrique y Aranjuez. Entre los capturados figura alias Dorian, presunto coordinador en Aranjuez de un grupo delincuencial y quien se encargaría de la distribución y expendio de estupefacientes en este sector de Medellín. (Consulte acá todas las noticias de Medellín y Antioquia de EL TIEMPO)""Estaban atacando sectores conocidos como Lovaina, el Faraón,  La Salle y el Pomar. Durante los procedimientos se incautaron 263 dosis de marihuana, 148 de cocaína, 87  de bazuco y una motocicleta que era utilizada para la movilización del estupefaciente"", apuntó el coronel Richard Fajardo, subcomandante de la Policía Metropolitana del Valle de Aburrá. El secretario de Seguridad y Convivencia de Medellín, José Acevedo, aseguró que 11 de los 19 homicidios ocurridos en Manrique en lo corrido de 2023 ya fueron esclarecidos por las autoridades. MEDELLÍNEscríbanos: sebbol@eltiempo.com"|https://www.eltiempo.com//files/article_content_new/uploads/2023/08/25/64e8cd26dc59a.jpeg
Murió fiscal de San Francisco, Antioquia, en trágico accidente vial|"
Las autoridades investigan si el hombre estaba conduciendo bajo los efectos del alcohol. "|25 de agosto 2023, 10:35 A. M.|"Hay conmoción en el municipio de San Francisco, Antioquia por la muerte de uno de los servidores públicos que trabajaba en la Fiscalía de ese municipio. Se trata de Libardo Arturo Escobar Giraldo, quien se desempeñaba como fiscal en un despacho de esa zona de Antioquia. (Le recomendamos leer: Voraz incendio en Itagüí deja tres personas heridas y 15 familias afectadas). El hombre de 65 años de edad se había desempeñado en dicha dependencia desde hace siete años. Según las primeras versiones entregadas de los hechos, el siniestro vial tuvo lugar el pasado miércoles 23 de agosto cuando Escobar Giraldo transitaba la autopista Medellín- Bogotá. Se dice que el hombre tomó un carril en contravía y que chocó contra un camión de una empresa de envíos que se movilizaba por el corredor. (Le podría interesar: En vivo | Avanza el tránsito de vehículos de carga por la vía Bogotá-Villavicencio).Así mismo, las autoridades investigan si el hombre estaba conociendo bajo los efectos del alcohol, según informó Juan Fernando Zuluaga, secretario de Tránsito de Marinilla. El conductor del otro vehículo resultó ileso. Las autoridades entregaran más detalles del accidente cuando se conozcan los resultados de autopsia y labores judiciales. ​REDACCIÓN ÚLTIMAS NOTICIAS"|
Voraz incendio en Itagüí deja tres personas heridas y 15 familias afectadas|"
Bomberos atendieron la emergencia que se presentó en la madrugada de este viernes. "|25 de agosto 2023, 09:20 A. M.|"Un voraz incendio se presentó en la madrugada de este viernes, 25 de agosto, en el barrio San Francisco de Itagüí, al sur del Valle de Aburrá, en límites con el corregimiento de San Antonio de Prado y cerca a la cárcel de máxima seguridad de La Paz. Según el reporte de las autoridades locales, las llamas se presentaron minutos antes de la 5 de la mañana. Bomberos de Itagüí y Medellín atendieron la emergencia con 3 máquinas, 2 carro tanques y 2 ambulancias, debido a la magnitud de la conflagración. (Lo invitamos a leer: Tragedia: ingeniero murió por bala perdida al salir al balcón de su casa en Medellín) El incendio estructural deja, de manera preliminar, 15 familias afectadas que son atendidas con apoyo psicosocial por parte de la administración municipal. La Dirección de Gestión de Riesgos de Desastres avanza en el censo de las personas para su reubicación y atención.(Le puede interesar: Estructuras criminales de Medellín aseguran que no hay ningún veto a candidatos) ""Estamos terminando de realizar la extinción de las llamas y el control de las pipetas de gas que se encuentran en el sitio y que se utilizaban para la cocción de alimentos"", señaló Lucas Espinosa, director de Gestión de Riesgo de Desastres. Los organismos de socorro confirmaron que el incendio no dejó personas fallecidas y en el lugar se atendieron tres heridos, dos por inhalación de humo y otro más por quemaduras. (Consulte acá todas las noticias de Medellín y Antioquia de EL TIEMPO)El riesgo en la zona es leve y tan pronto como termine la remoción de los escombros se avanzará en la identificación de las viviendas afectadas y las respectivas familias que habitaban en el lugar. MEDELLÍNEscríbanos: sebbol@eltiempo.com"|
En Ginebra capturan a alias 'El mocho', reconocido actor sicarial y de estupefacientes|"
La Policía Valle busca golpear las finanzas del crimen organizado en el departamento."|25 de agosto 2023, 08:04 A. M.|A través de nueve diligencias de allanamiento fueron capturadas nueve personas en flagrancia en zona rural del municipio de Ginebra (Valle del Cauca), entre ellas, alias ‘El mocho’, reconocido actor sicarial dedicado al crimen y al tráfico de estupefacientes.(Le puede interesar: Cayó presunto autor material del crimen de un policía que fue asesinado tras un hurto) De 53 años de edad y con amplia experiencia en el mundo de la delincuencia, ‘El mocho’ tendría una importante injerencia en Buga y municipios aledaños, donde según las autoridades, realizaría trabajos bajo el modelo ‘outsourcing’ con actores carcelarios, como alias ‘Luis Cuevas’ y ‘Monacho’ en la venta ilegal y comercialización de estupefacientes en pequeñas cantidades, que son distribuidos en discotecas, colegios y sitios abiertos al público. Durante los allanamientos, las autoridades también lograron incautar dos armas de fuego tipo pistola y escopeta, así como proveedores y munición para las mismas. También, dosis de estupefacientes de clorhidrato de cocaína y marihuana, dos radios de comunicación y una gramera. (Además: Alcalde de Cali publicó video que identifica al presunto agresor de músico nariñense)“Con estas capturas logramos afectar las finanzas de una posible red criminal dedicada al narcotráfico, los cuales por el control territorial cometen homicidios selectivos, hurtos y demás delitos conexos. También evitamos que estos estupefacientes sigan llegando a manos de nuestros niños, niñas y adolescentes, que bastante daño les hace”, comentó el coronel Jesús Enrique Quintero Rave comandante Departamento de Policía Valle del Cauca. El uniformado destaca que estos resultados hacen parte del Plan Choque Seguridad 360, en el que “focalizamos los delitos de mayor impacto como el homicidio, el hurto en todas sus modalidades y el tráfico de estupefacientes, logrando afectar las finanzas económicas de estos presuntos actores delincuenciales en los municipios de Guacarí, Ginebra y sitios aledaños al municipio de Buga”. CALI|
Hombre evadió controles de aeropuerto en EE.UU. e ingresó al país 107 partes de fusiles|"
Autoridades lograron detener al presunto responsable en una vivienda de Aguablanca, en Cali."|25 de agosto 2023, 07:50 A. M.|"Un hombre habría logrado ingresar al país 107 partes de fusiles y evadir los controles en el aeropuerto Palm Beach, en Estados Unidos, para que llegaran a Bogotá. El arsenal arribó al aeropuerto El Dorado, en la capital del país. El responsable de tal carga se habría estado ocultando en una humilde vivienda del barrio Marroquín, en distrito de Aguablanca, el cual, está localizado en el oriente de la ciudad. (Lea también: Indignación: a machete, un hijo intentó matar a la madre, luego de lanzarle un armario)De acuerdo con la Policía, el hombre fue detenido en cumplimiento del 'Plan choque seguridad 360', para prevenir la ocurrencia de los delitos que afectan la seguridad ciudadana en especial los priorizados, como homicidio, hurto en todas sus modalidades, tráfico de estupefacientes y extorsión. ""Esta persona es solicitada por los delitos de fabricación, tráfico y porte de armas, municiones de uso restringido, de uso privativo de las Fuerzas Armadas o explosivos y concierto para delinquir agravado"", indicaron en la Policía Metropolitana de Cali. (Además: Grave accidente de bus con ruta de Cali a Bogotá: se volcó y hay siete heridos)""Gracias al trabajo articulado, los investigadores de la Policía Fiscal y Aduanera, lograron recolectar evidencias suficientes, para que la Fiscalía General de la Nación, solicitara ante los señores jueces de Control de Garantías se emitiera orden de captura a esta persona"", anotaron. (Lea también: Crecen amenazas a guardianes en cárcel de Tuluá: estos son los responsables y razones)Las 107 partes de armas de fuego tipo fusil fueron incautadas por la Policía Fiscal y Aduanera en coordinación con delegados de la Dian. Se les venía haciendo un rastreo para establecer a que grupo delincuencial estarían siendo comercializadas.CALI"|
¿Estudiar en la Unión Europea? Este viernes hay una feria de opciones|"
EurOportunidades completa su segundo día en la universidad del Valle, en el sur de Cali"|25 de agosto 2023, 05:05 A. M.|Las posibilidades de estudiar ganan sus horizontes fuera del continente americano.Hoy, Colombia es el séptimo país con más becarios y becarias de maestría estudiando en Europa, dice el embajador de la Unión Europea en Colombia, Gilles Bertrand.Desde ayer y este viernes se vive la tercera edición de #EurOportunidades 2023, en la universidad del Valle, sede Meléndez.En la presentación estuvieron la vicerrectora académica de Univalle, Liliana Arias; y el director ejecutivo de Asociación Colombiana de Universidades (Ascun), Óscar Domínguez, Este viernes se reúnen universitarios, así como egresados, docentes e investigadores. Delegados de Estados Miembros de la UE presentarán la oferta académica. En ese espacio se presentan casos de éxito regionales y testimonios de estudiantes e investigadores becados por la Unión Europea y sus Estados Miembros.(Le puede interesar: El milagro de agua en 2 poblados del Pacífico, rodeados de selva y mar) De acuerdo con el embajador Bertrand, “nuestra cooperación académica y científica es quizás la mejor expresión de la gran cercanía cultural y humana entre Colombia y la Unión Europea. Pese a la distancia geográfica, Colombia está entre los 10 países no europeos que participan en más acciones de cooperación científica. Esta tercera edición de #EurOportunidades 2023 es la primera que organizamos de forma presencial y nos alegra hacerlo en Cali, con participación de universidades y estudiantes de todo el suroccidente colombiano”(Puede leer: Indignación: a machete, un hijo intentó matar a la madre, luego de lanzarle un armario) Dijo que las #EurOportunidades son para todas y todos y seguiremos trabajando para hacerlas conocer en todas las regiones del país.La directora de Relaciones Internacionales Univalle, Adriana Guzmán, considera que “es una valiosa oportunidad para descentralizar la información de ofertas educativas y becas en los Estados Miembros de Unión Europea”.(Además, puede leer: ¿Quién es el nuevo comandante del Departamento de Policía Valle?) EurOportunidades nace de la cooperación entre Univalle, anfitriona y sede oficial, la Asociación Colombiana de Universidades (Ascun), la iniciativa de la Comisión Europea destinada a reforzar la colaboración científica con Europa- Euraxess, y la Delegación de la Unión Europea en Colombia. Se brindará información sobre las becas para Másteres conjuntos Erasmus Mundus (EMJM), que permiten estudiar en al menos dos países europeos. Crecen amenazas a guardianes en cárcel de Tuluá: estos son los responsables y razones|
Campeón mundial de boxeo fue víctima de robo en Cali; le hurtaron sus guantes|"
Según el testimonio del deportista, el hecho sucedió en Ciudad Jardín, sur de Cali."|25 de agosto 2023, 04:32 A. M.|La delincuencia es uno de los mayores problemas del país. Esta vez la víctima fue Óscar Rivas, campeón mundial de boxeo, a quien le robaron un maletín que tenía sus guantes. El hecho fue compartido en redes sociales por medio de un video, en el que el deportista señaló que se encontraba muy afligido con la situación. Rivas contó lo sucedido. De acuerdo con su testimonio, los delincuentes rompieron la ventana de su vehículo y extrajeron un maletín, en el cual estaban los guantes de uno de los deportistas más destacados del país. El suceso se dio en Ciudad Jardín, al sur de Cali, mientras el campeón se encontraba grabando. Así, Rivas comentó lo triste que estaba por lo que le había pasado. (Puede leer: Indignación: a machete, un hijo intentó matar a la madre, luego de lanzarle un armario). “La verdad que me siento muy afligido por estas cosas que pasan. Hay personas que no saben el valor que tienen las cosas para cada persona”, dijo en un video difundido en redes. “Las cosas que están dentro de esa maleta tiene un valor muy importante para mí”, agregó. Además, pidió ayuda de la comunidad y de las autoridades para recuperar el bolso. “Esos guantes no tienen ningún valor para esas personas, pero para mí sí lo tienen”, finalizó. GERALDINE BAJONERO VÁSQUEZREDACCIÓN ÚLTIMAS NOTICIAS Alcalde de Cali publicó video que identifica al presunto agresor de músico nariñense Cayó presunto autor material del crimen de un policía que fue asesinado tras un hurto Capturan a banda señalada hasta por tres homicidios en el oriente de Cali|
Un impulso al empoderamiento femenino en el comercio ferretero|"
La tienda 18 de Mundial de Tornillos®, la marca colombiana, será atendida únicamente por mujeres."|25 de agosto 2023, 08:57 A. M.|Mundial de Tornillos® abre su nueva tienda en Paloquemao, el centro comercial de cielos abiertos más grande de Colombia, con una inversión de aproximadamente cinco mil millones de pesos. La empresa busca impulsar su plan de crecimiento y ha apostado por el empoderamiento de las mujeres en el ámbito empresarial del comercio ferretero y de la construcción. Con esta inauguración, Mundial de Tornillos® busca fortalecer su presencia en Paloquemao, Bogotá, conocido como el corazón ferretero de Colombia. La empresa busca ofrecer un servicio más ágil y cómodo, priorizando las entregas inmediatas. “Los objetivos y metas que tenemos establecidos para esta tienda son poder ampliar la participación de mercado que tenemos en la zona industrial más importante de Latinoamérica que es Paloquemao. Allí buscamos unas ventas mucho más rápidas, una atención express y vamos a tener mayor exhibición de herramienta”, explicó Julián Cardona Marín subgerente de Mundial de Tornillos®. Esta nueva tienda, la número 18 de la marca en el país, cuenta con un formato exprés de 400 metros cuadrados y una exhibición de herramientas en Show Room. La característica más notable de este nuevo punto de venta es que será administrado exclusivamente por mujeres, lo cual se alinea con los esfuerzos mundiales para promover la igualdad de género y el empoderamiento de las mujeres en el ámbito empresarial. “En un sector que ha sido tradicionalmente muy machista, pero en el cual también vemos participación de las mujeres en diferentes cargos y posiciones en todas las áreas, desde bodega hasta gerentes, y esto es precisamente lo que queremos fomentar, la participación de ellas, darles ese espaldarazo y mostrar el papel tan importante que podemos desempeñar teniendo más mujeres en el sector ferretero”, agregó Cardona. La apertura de esta tienda no solo trae consigo una nueva opción para los consumidores, sino que también envía un mensaje de cierre de brecha de género en el ámbito laboral en el rubro de la economía. La empresa busca equiparar los puestos de trabajo y las oportunidades salariales. El personal femenino de esta tienda se encuentra capacitado para brindar el mejor asesoramiento técnico y recomendaciones a los clientes para encontrar las soluciones adecuadas para sus proyectos. Se espera que esta tienda sea la mejor calificada en atención por parte de los usuarios. En ese sentido, el sugerente de la compañía expresó que, “vamos a tener una atención mucho más ágil, con conocimiento de expertas, un equipo altamente competitivo que entiende, que escucha, que asesora profesionalmente a un nivel diferente y también genera más simpatía, generando una experiencia de compra mucho más agradable, cercana y eficiente”. Es importante recordar que, la marca Super Tools®, propia de Mundial de Tornillos®, también tendrá un espacio protagónico en esta nueva tienda. La empresa ha ampliado su portafolio de herramientas, convirtiéndose en uno de los jugadores más importantes en esta categoría en Colombia. “Los planes de expansión de nuestro negocio buscan que la compañía se posicione con líneas en tornillería inoxidable y también como un referente en la venta de herramientas como equipos de soldadura, abrasivos, penetrantes, lubricantes y todo tipo de sistemas de fijación como brocas, un portafolio de la mejor calidad a un precio justo”, concluyó Cardona. Vale la pena recalcar que, Mundial de Tornillos® abrirá próximamente una nueva tienda en Pereira, eje cafetero. La apertura de esta nueva tienda representa la consolidación del plan de expansión nacional de la compañía, que continuará en el Eje Cafetero en el segundo semestre. Mundial de Tornillos® espera seguir creciendo y posicionándose en el mercado gracias a su amplio catálogo de herramientas y su compromiso con la igualdad de género en el ámbito laboral.|
La reacción de Shakira al conocer el monumento que le hacen en Barranquilla|"
La artista barranquillera reaccionó este viernes a través de sus redes sociales."|25 de agosto 2023, 10:22 A. M.|“Me siento conmovida y profundamente agradecida”, fueron las palabras de agradecimiento que este viernes expresó la cantante barranquillera Shakira al conocer los avances de la escultura que en su honor estos momentos se construye en Barranquilla.(Además: Video: así va la escultura de 6.40 metros de Shakira que se construye en Barranquilla)La ganadora de tres veces el Grammy anglo no ocultó su sorpresa al ver el video que circula por las rede sociales en el que se muestra la escultura, por lo que agradeció al artista y su equipo, lo mismo que al alcalde Jaime Pumarejo promotor del proyecto. “Este honor que me hacen las manos de este artista y su equipo, talento extraordinario de mi tierra. Gracias alcalde y gracias mi Barranqulla linda! Te mereces todo! Los quiero tanto!”, remata el mensaje de la artista en sus redes sociales. En estos momentos la escultura se levanta en los talleres de Yino Márquez, en el barrio La Paz, sur de la ciudad.Se trata de un monumento de bronce de 6.40 metros de altura y pesará entre 3 y 4 toneladas, será de color miel. La falda será una mezcla de bronce y aluminio. Márquez le mostró los avances de la obra al alcalde Jaime Pumarejo, quien hizo un video y lo subió a sus redes sociales, en lo que se ve parte de la imagen de la artista barranquillera.(También: Nuevo incendio forestal en la Isla de Salamanca ahoga al norte de Barranquilla) “Es una obra de arte que no tiene nada que envidiarle a cualquiera ya creada en el mundo”, dijo el alcalde Pumarejo cuando vio los avances de la escultura.La escultura se encuentra en un 70 por ciento, Márquez y su equipo conformado por jóvenes de la Escuela Distrital de Arte (EDA) llevan 45 trabajando en este proyecto.Sobre el sitio donde se ubicará la estatua no está definido, para ello el Distrito está escuchado.La intención es que la obra sea inaugurada antes de finalizar el año y que ese día este Shakira en Barranquilla, en el acto que la ciudad le rinde homenaje a su obra artística y gestión social en favor de los pobres de esta capital.A lo largo de su carrera, la barranquillera ha ganadora 3 premios Grammy anglo y 12 Grammy Latino, 10 premios American Music Award, 13 premios Billboard, 4 premios HTV, 23 premios Lo Nuestro, entre muchos otros galardones, además de millonarias ventas por sus álbumes y giras internacionales.(Lea: Directivo de tránsito en Santa Marta involucrado en desaparición de motos inmovilizadas)Con su fundación Pies Descalzo ha construido dos megacolegios en esta capital, al que asisten más de 4.000 niños de los barrios pobres. Escríbeme leoher@eltiempo.com o @leoher70 si tienes una historia que quieres que cuente.|https://www.eltiempo.com//files/article_content_new/uploads/2023/08/25/64e89a321ed04.jpeg
Nuevo incendio forestal en la Isla de Salamanca ahoga al norte de Barranquilla|"
Desde la noche del jueves se presentan quemas en la reserva natural del departamento del Magdalena."|25 de agosto 2023, 08:19 A. M.|Los barrios del norte de Barranquilla amanecieron este viernes sofocados por el humo que arrastran las brisas de un nuevo incendio forestal en el parque Isla de Salamanca.(Además: Así va la escultura de 6.40 metros de Shakira que se construye en Barranquilla)Las conflagraciones en esta reserva natural localizada en frente de Barranquilla, en el departamento del Magdalena, se iniciaron desde la noche del jueves. En imágenes que circulan por las redes sociales se aprecia las columnas de humos que salen del parque. (También: Golpe al ‘Negro Ober’ y ‘los Rastrojos Costeños’ en Barranquilla: 18 capturas)Desde el departamento del Magdalena las autoridades no han reportado hasta el momento el lugar y las acciones para sofocar este incendio forestal.(Lea: Sabor Barranquilla 2023 recibe a Jorge Rausch: 'Barranquilla me sabe a progreso')En Barranquilla los barrios más afectados con estas quemas son Villa Carolina, Paraíso, Siape, San Salvador, entre otros. Escríbeme leoher@eltiempo.com o @leoher70 si tienes una historia que quieres que cuente.|
