titular|encabezado|fecha|cuerpo|imagen
Rodolfo Hernández no se ha sometido a cirugía para extraer su tumor|"
El ingeniero indicó en meses pasados que deberá someterse a una terapia para tratar el cáncer."|12 de agosto 2023, 05:42 P. M.|"Aunque se aseguró en redes sociales que En Bogotá, en el Centro de Tratamiento de Investigación de Cáncer Luis Carlos Sarmiento Angulo, fue intervenido quirurgicamente el excandidato presidencial Rodolfo Hernández para que le extrajeran el tumor que tenía en el colon, el hoy candidato a la Gobernación de Santander confirmó a través de sus redes sociales que está en Bucaramanga y no ha sido operado. Puede leer: Rodolfo Hernández: expertos explican en qué consisten los tumores en el colon El tumor maligno que tiene el ingeniero, según los expertos, es tratable, pero debe estar en quimioterapia y luego someterse a una cirugía para extraerle la masa. El 18 de junio Hernández contó que la patología del cáncer se descubrió al sentirse en varias ocasiones con malestar de llenura. ""Me fui a Colsanitas, me sacaron sangre, me dijeron que tenía anemia, que estaba perdiendo glóbulos rojos, es decir, que estaba sangrando  que podría ser úlcera o cáncer, me detectaron cáncer de colon. Este cáncer que tengo es de dos etapas, una, quimioterapia, dieta y comer cosas alcalinas, ejercicio duplicarlo en  fuerza y tiempo y operación"". En su momento, invitó a los colombianos a realizarse una colonoscopia para detectar a tiempo esta enfermedad. MELISSA MÚNERA ZAMBRANOCorresponsal de EL TIEMPO - Bucaramanga."|
Estos son los 310 candidatos al Concejo de Medellín|"
El 60 por ciento son hombres; el 40 por ciento, mujeres. La mayoría van por listas abiertas. "|11 de agosto 2023, 03:22 P. M.|En Medellín hay 186 hombres y 124 mujeres que buscan alcanzar una de las 20 curules que se elegirán el próximo 29 de octubre para el Concejo distrital. Aunque la corporación tiene 21 miembros, el cupo restante será para quien quede de segundo en la carrera por la alcaldía. (Lo invitamos a leer: En Antioquia hay 15.720 candidatos inscritos para las elecciones regionales de octubre)En total son 17 las listas de partidos, coaliciones o movimientos ciudadanos que presentaron 310 nombres ante la Registraduría Nacional del Estado Civil para elegir a los encargados de hacer control político al próximo alcalde y debatir proyectos de acuerdo claves como el nuevo plan de desarrollo, el POT y presupuesto anual. El 88 por ciento de los aspirantes están inscritos en listas de voto preferentes o abiertas (14), es decir, que el elector puede votar directamente por su candidato en los comicios. El 12 por ciento restante corresponde a listas con voto no preferente o cerradas (3) donde las curules ganadas por el partido se asignan según el orden del listado. (Le puede interesar: Elecciones 2023: estos son los candidatos que van por la Alcaldía de Medellín)El consolidado entregado por la Registraduría evidenció que hay 11 listas avaladas por partidos políticos, 5 por coaliciones y solo una por un movimiento ciudadano. Se trata de 'Medellín nos une' que apoya el candidato por la alcaldía Albert Corredor. Todas las lista cumplen con las disposiciones definidas por la ley en cuanto al número de hombres y mujeres inscritos con respecto al total de candidatos. Sin embargo, algunos partidos presentan unas cifras con mayor paridad con porcentajes entre el 42 por ciento y el  57 por ciento. Estas son Creemos, Fuerza de la Paz y Liberal.La edad promedio del total de candidatos es de 42 años. El  partido que tiene menor edad promedio es Fuerza de la Paz, con 29 años, y el que tiene uno más alto es Gente en Movimiento con 50 años. Hay dos candidatos con 18 años —Melissa Arango de la Alianza Verde y Juan Esteban Martínez de Salvación Nacional— y la persona con mayor edad que aspira llegar al Concejo es Gloria Astrid Piedrahita, del partido Creemos, con 74 años. El partido con menor número de candidatos inscritos (6) es el Ecologista, mientras que 10 movimientos, partidos o coaliciones inscribieron el número máximo de candidatos que permite la ley para Medellín: 21. A continuación puede consultar el listado completo de candidatos al Concejo de Medellín. Tenga en cuenta que la aparición de los candidatos se da por orden alfabético. Puede utilizar la herramienta de buscador para encontrar al aspirante o partido de su preferencia. Quien tiene el número '1' en la lista corresponde a la cabeza de la misma. (Consulte acá todas las noticias de Medellín y Antioquia de EL TIEMPO)MEDELLÍNEscríbanos: sebbol@eltiempo.com|
Estos son los candidatos a Alcaldía de Floridablanca|"
Son 11 políticos los que se pelean la administración de la ciudad dulce, en Santander. "|11 de agosto 2023, 10:53 A. M.|En la baraja de candidatos que se lanzaron para la Alcaldía de Floridablanca solo hay una mujer y hay variedad de personas que no habían tenido experiencia en la carrera política como periodistas y líderes comunales.Puede leer: Elecciones 2023: estos son los candidatos que se pelearán la Alcaldía de BucaramangaAdemás, hay ex concejales que quieren ser alcaldes, pero están en la lupa de las autoridades, pues tendrán audiencia de juicio en septiembre por ser investigados por presuntas irregularidades en la elección del personero. -Jhair Andrés Manrique, se lanzó con  el movimiento  Salvación Nacional-Milton Villamizar Afanador,  fue exconcejal de Floridablanca, exdiputado y exsecretario de Desarrollo de Santander. Es apoyado por el Centro Democrático y  Partido demócrata colombiano.Lea también: Elecciones2023: conozca quiénes son los candidatos a la Gobernación de Santander-Sergio Flechas irá por el movimiento ciudadano Renovación Popular-Milady Tovar Cabarique,  quien fue concejal en Floridablanca es apoyada por el Partido Verde y es la única mujer en esta contienda electoral. - Diego Jaimes se inscribió en la Registraduría por ASI, y Dignidad y Compromiso.- Juan Pablo Pérez, conocido como P3 y quien es periodista desde hace 25 años y su familia ha estado detrás de los medios de comunicación, decidió lanzarse y es apoyado por Nueva Fuerza Democrática- Juan de Dios Tarazona, va por el Pacto Histórico-Oscar Guerra, tiene el respaldo por el Partido Ecologista Colombiano José Fernando Sánchez, fue concejal de Floridablanca en dos períodos y se inscribió por el grupo significativo llamado Floridablanca en orden, recogiendo 122.052 firmas. También, está siendo apoyado por la política tradicional, pues los liberales, conservadores y Cambio Radical lo respaldan. - Juan Carlos Ayala, quien fue concejal también de la ciudad dulce, es apoyado por la Liga de Gobernantes Anticorrupción,  es decir, tiene el respaldo del excandidato presidencial Rodolfo Hernández. Estos dos candidatos actualmente están siendo investigados por la Fiscalía ante presuntas irregularidades en el proceso de la elección del personero cuando ejercían como concejales. El 18 de septiembre, prácticamente, un mes antes de elecciones, inicia el juicio oral contra ellos y otros corporados. Jefferson Vega, quien es de San Vicente de Chucurí, y viudo de la exdiputada, Ángela Hernández, quien fue una mujer contundente con sus creencias y convicciones y murió a causa de un cáncer de mama, decidió seguir en la carrera política y va por el movimiento Creemos. MELISSA MÚNERA ZAMBRANOCorresponsal de EL TIEMPO - Bucaramanga.|https://www.eltiempo.com//files/article_content_new/uploads/2023/08/11/64d650b26d217.jpeg
Elecciones 2023: los candidatos que van por la Alcaldía de Medellín|"
Hasta último minuto se inscribieron algunos candidatos que buscan suceder a Daniel Quintero. "|31 de julio 2023, 08:30 A. M.|"Se comienza a esclarecer el panorama para los aspirantes a reemplazar a Daniel Quintero como alcalde de Medellín en el cuatrienio 2024-2027.De la treintena de candidatos que comenzaron a sonar a principio de año, la mitad inscribieron su candidatura antes de la fecha límite para realizar este proceso ante la Registraduría Nacional del Estado Civil. (Lo invitamos a leer: Estos son los candidatos que se inscribieron para elecciones a gobernador de Antioquia) Aunque se vislumbra que la puja entre el continuismo y la derecha será la protagonista en lo que sigue de la contienda electoral, también hay varios candidatos del llamado ‘centro’ que buscan despolarizar la discusión.Estos son los candidatos que siguen en carrera por la alcaldía y los que, por una u otra razón, desistieron de su intento.(Le puede interesar: Feria de las Flores inició en medio de polémicas y la expectativa de los silleteros) Federico Gutiérrez fue uno de los últimos que anunció su candidatura a la Alcaldía, pero uno de los primeros en inscribirse en la última semana.Lo hizo el pasado martes 25 de julio y, al respecto, el exalcalde manifestó que su candidatura ofrece “un programa de gobierno con un diagnóstico claro de cómo está la ciudad y sobre todo cómo la vamos a recuperar porque sabemos cómo hacerlo”. El documento presentado por ‘Fico’ evaluó más 40 temas con la participación de expertos, académicos, organizaciones sociales, empresarios y líderes comunitarios y la propuesta ' abarca tres ejes principales: la transparencia, la confianza y la cultura ciudadana.Como la apuesta por la continuidad del gobierno Quintero, Juan Carlos Upegui se inscribió como candidato por el mismo partido del alcalde, el movimiento Independientes.Indicó Upegui que seguirá recorriendo las calles de la ciudad y que, entre sus propuestas para Medellín, está la creación de 200.000 empleos, la construcción de cinco metrocables y reducir los hurtos en la ciudad.(Lo invitamos a leer: Medellín: polémica por creación de grupo de seguridad formado por civiles en Comuna 13) Otro de los que también se inscribió fue Juan Camilo Restrepo, excomisionado de Paz del gobierno de Iván Duque, y quien por varios días fue alcalde ad-hoc de Medellín tras la suspensión de Quintero en mayo del 2022.Restrepo, que comenzó recogiendo firmas movimiento significativo de ciudadanos Medellín Somos Todos, también recibió el aval del partido Salvación Nacional.Lo mismo hizo Luis Bernardo Vélez, concejal de Medellín y quien en las pasadas elecciones a la Alcaldía desistió en su candidatura para apoyar a Quintero. Sin embargo, actualmente, es uno de los más férreos contradictores del alcalde. En el momento de la inscripción, Vélez manifestó que su candidatura es una opción diferente, alejada de la polarización y las peleas que, para él, no dejan avanzar a la ciudad y la tienen sumida en grandes problemas.“Medellín necesita un alcalde que asuma la responsabilidad de la ciudad para devolverle la tranquilidad y la esperanza a los ciudadanos y unir las fuerzas para cuidarla, por ello inscribo hoy mi candidatura a la alcaldía de Medellín”, resaltó el hoy candidato.Liliana Rendón, exconcejala de Medellín y excandidata a la Gobernación, cierra la lista de los candidatos que es inscribieron antes del sábado. Rendón, que va por firmas, oficializó su candidatura en la mañana del, 28 de julio.Entre los que se inscribieron el último día está el concejal de la Alianza Verde, Daniel Duque, quien oficializó su candidatura por este partido en la mañana del sábado, 29 de julio.Su apuesta política incluye una lucha contra la corrupción, un hábitat sostenible que se adapte a la crisis climática y un gran componente de educación. El candidato ha insistido en la necesidad de conformar un bloque de centro de cara a los comicios de octubre.(Lea, además: Así avanza la ejecución presupuestal de la alcaldía de Daniel Quintero en Medellín) También confirmó su candidatura el exdirector del Inder durante la administración de Federico Gutiérrez. Se trata de Juan David Valderrama, quien oficializó su aspiración con el movimiento 'Proponemos'. ""Nos mueve el amor por Medellín. Vamos a enfocarnos en el cuidado de los recursos naturales, el transporte público masivo y sin dudas las oportunidades es nuestra gran apuesta"", expresó Valderrama, quien ya fue candidato en 2019, pero no le alcanzó para llegar a la Alpujarra. También por la mañana inscribió su candidatura César Hernández por el movimiento 'Manos por Medellín'. Hasta la víspera del último día estuvo a la espera de la emisión de la póliza de seriedad. Hernández ocupó diferentes cargos públicos en los últimos años y trabajó para los gobiernos de Sergio Fajardo en la gobernación de Antioquia (2012 - 2015) y Federico Gutiérrez en Medellín (2016 - 2019). (Puede leer: El túnel más largo de Colombia está a 300 metros de unirse: vea la impresionante obra)Carlos Ballesteros, el elegido por el Pacto Histórico para Medellín, inscribió su candidatura a la Alcaldía en la tarde del sábado. Lo propio hizo Felipe Vélez, quien fue director de Planeación durante la alcaldía de Federico Gutiérrez. El exfuncionario se inscribió con el aval del grupo ciudadano 'Con Felipe Medellín vuelve a brillar'.A última hora, la exconcejala Paulina Aguinaga confirmó la inscripción de su candidatura por el movimiento 'Por Medellín'. Su programa de gobierno se enfoca en la transformación de una ciudad en referente de equidad, desarrollo y sostenibilidad para todos. Por su parte, otro de los que se ha visto mucho en publicidad y recogiendo firmas es Albert Corredor, exconcejal del Centro Democrático y a quien pone como uno de los cercanos a Daniel Quintero.Corredor indicó que ya entregaron las firmas y quedó inscrita su candidatura, pero que está a la espera de la verificación de las firmas por parte de la Registraduría.(Le recomendamos leer: Personería anuncia vigilancia administrativa por luces 'estrober' en calles de Medellín) Rodolfo Correa, a quien le negaron las más de 110.000 firmas que recogió, expresó que se encuentra en proceso para revalidar la información“Hemos encontrado cerca de 8.500 errores en el registro del software que usa la Registraduría y no nos vamos a dejan vencer porque lo que está en juego es el trabajo de nueve meses y la voluntad de más de 112.000 personas”, expresó el ex secretario de Agricultura de Aníbal Gaviria. El candidato solicitó ante la Comisión Interamericana de Derechos Humanos una medida cautelar por los errores del software de la Registraduría y otros ataques que habría recibido su campaña. Sin embargo, confirmó que recibió el aval del partido Colombia Renaciente para seguir en la puja electoral.Uno que sonó con mucha fuerza a principio de año y luego perdió impulso fue el profesor Gilberto Tobón Sanín, quien a través de sus redes sociales confirmó que estará en el tarjetón por la alcaldía de Medellín.La lista de 15 candidatos que buscan suceder a Daniel Quintero la cierra Deicy Bermúdez, quien irá por el Partido Ecologista Colombiano. Andree Uribe, exsecretaria de Salud de la Alcaldía de Daniel Quintero, y que se alejó del partido Independientes por diferencias en la metodología para elegir candidato, optó por irse sola mediante firmas.Sin embargo, confirmó el viernes que no seguirá con el proceso debido a que no contaba con el capital económico para seguir con este proceso. De otro lado, Claudia Carrasquilla, exdirectora de Fiscalías, también se bajó de la candidatura para la alcaldía debido a que le negaron la inscripción por una supuesta suplantación en el nombre del movimiento por el que estaba recolectando firmas.(Consulte acá todas las noticias de Medellín y Antioquia de EL TIEMPO)El concejal Sebastián López, el exconcejal Simón Molina y el líder de la revocatoria de Daniel Quintero, Andrés ‘Gury’ Rodríguez, declinaron sus aspiraciones para la Alcaldía. López y Rodríguez irán como candidatos al Concejo por el Centro Democrático.ALEJANDRO MERCADO Y SEBASTIÁN CARVAJAL EL TIEMPO - MEDELLÍN"|
Cartagena tiene 15 candidatos inscritos a la Alcaldía|"
Los tres con mayor favorabilidad cuentan con reconocimiento en el sector político."|31 de julio 2023, 10:42 A. M.|Tras finalizar el proceso de inscripción de candidatos a cargos de elección popular el pasado 29 de julio, en Cartagena la lista de candidatos llegó a los 15 aspirantes que buscan gobernar la ciudad durante el periodo 2024-2027.(Lea también: Cartagena: suspendieron a enfermero que peleó con padre de familia dentro de clínica)El cierre de la jornada de inscripción estuvo envuelta en quejas y discusiones, porque la Regustraduria reportó fallas en el sistema, lo que generó la molestia de varios partidos. La extensa lista de candidatos a la Alcaldía de Cartagena cuenta con reconocidos nombres en el sector político y varios desconocidos que le apuestan a convertirse en la máxima autoridad de la capital de Bolívar. Un exgobernador, una exalcaldesa, un excandidato a la Alcaldía son los que lideran las encuestas y sondeos. Dumek Turbay, exgobernador de Bolívar, quien lidera las encuestas y fue el primero en inscribirse por el partido Nuevo Liberalismo y el Partido Demócrata Colombiano. Turbay cuenta con aceptación en las bases populares, que le reconocen su trabajo como gobernador; pero también hay quienes le cuestionan por las investigaciones que le adelantan entes de control, los que según él no son más que ataques políticos. El segundo en esa lista de favorabilidad es William García, excongresista, exconcejal y excandidato a la Alcaldía de Cartagena en las pasadas elecciones.García ha sido criticado por no haber participado en debates en la pasada contienda y de haberse alejado de temas coyunturales de la ciudad en los últimos cuatro años. En esta contienda entra a terciar Judith Pinedo 'Maríamulata', que tras ser declarada inocente de la venta de playas por lo que estuvo privada de la libertad por dos años, decidió aspirar nuevamente a ser mandataría con el aval de Alianza Verde, Pacto Histórico y el movimiento 'Lxs Valientes'. Pinedo ha sido señalada desde supuestamente ser la candidata del alcalde William Dau, quien al parecer habría dispuestos de la Secretaría de Educación y Participación para contratos de OPS de personas cercanas a Maríamulata.(Además: Indignación en Cartagena por mujer que usa a niña para robar en centro comercial) Dumek Turbay Paz por los Partidos en Marcha con coaval del Nuevo Liberalismo); William García Tirado, Movimiento Significativo Los Tres Golpes; Javier Doria, Movimiento Significativo Cartagena Fuerte y Libre; Fernando Tinoco Tamara (ASI).Nausicrate Pérez Daut, Oxígeno Verde; José Luis Osorio, Partido Independiente; Reynaldo Tovar, AICO; Luis Carvajalino, Liga de Gobernantes Anticorrupción; Jaquelin Perea Blanco, Nueva Fuerza Democrática.Fabio Aristizábal, Salvación Nacional; Gustavo Martínez, Gente en Movimiento; Judith Pinedo Flórez, Movimiento Significativo Valientes por Cartagena; Héctor Pérez, Colombia Justa y Libre; Javier Julio Bejarano, Pacto Histórico; Richard Martínez, Colombia Renaciente. - Caribe Aventura, el parque temático al que apuesta Atlántico en desarrollo turístico - Artefacto explosivo destruyó la escuela donde estudió Francia Márquez en Cauca - Quedaron listas las candidaturas para la Gobernación de Boyacá: conozca los postulados|https://www.eltiempo.com//files/article_vertical_content_new/uploads/2023/07/31/64c7d2c25c0fb.jpeg
Elecciones 2023: los candidatos que aspiran a la Alcaldía de Neiva|"
Diez hombres se inscribieron para ocupar el puesto de Gorky Muñoz."|01 de agosto 2023, 01:33 P. M.|El pasado sábado fue la fecha límite para que las personas interesadas se inscribieran a aspirar a cargos públicos en las próximas elecciones de octubre. En Neiva diez hombres aseguraron su candidatura.Uno de ellos es Germán Casagua, exconcejal de la ciudad y quién se inscribió con 179.510 firmas. Otro candidato es Jorge Andrés Géchem, militante del partido de la U. y exmiembro de la Asamblea del Huila. También se lanzó Wilker Bautista, quien recogió 163.500 firmas y cuenta con el aval del Partido Verde Oxígeno. Amin Losada también se lanzó, tras su paso por el conejo. Otro candidato es Yilber Saavedra, quien presentó 101.000. Germán ‘Chicho’ Rodríguez se inscribió con el movimiento ciudadano “Chicho Avanzando Ando”.Por su parte, Oscar Zúñiga Córdoba es el aspirante de la Colombia Humana. Héctor Javier Osorio, quien fue alcalde de Neiva entre 2001 y 2003 busca repetir. Los dos últimos en inscribirse, sobre la fecha límite, fueron Wilmar Elí Charry Ruiz del partido Ecologista Colombiano y Dagoberto Marín del Partido Liga de Gobernantes Anticorrupción.Las elecciones regionales serán el próximo 29 de octubre. Las personas que aún quieran cambiar su puesto de votación tienen hasta el 29 de agosto para hacerlo. Silvia Contreras RodeloRedactora de NaciónEL TIEMPO|
