titular|encabezado|fecha|cuerpo|imagen
Así funciona el poder político de Dilian Francisca Toro en el Valle|"
La expresidenta del partido de ‘La U’ va por su segunda candidatura a la Gobernación del Valle."|16 de agosto 2023, 12:00 A. M.|Luego de confirmar el pasado 25 de julio su salida de la dirección del partido de ‘La U’, Dilian Francisca Toro dio inicio a su carrera por la Gobernación del Valle, cargo que ya ejerció entre 2016 y 2019. A sus 64 años, la ‘Baronesa de Guacarí’, como la llaman algunos analistas políticos, se mantiene en la arena política para las elecciones regionales en octubre próximo donde –explican expertos– demostrará que aún mantiene su poder político no solo en el Valle del Cauca, sino también a nivel nacional. La capacidad electoral de Toro en el Valle es enorme y basta con ver a la actual gobernadora, Clara Luz Roldán, una de sus pupilas, que ganó la contienda departamental con 945.238 votos, el 56,17 por ciento, mientras que ninguno de sus ocho rivales obtuvo siquiera el 10 por ciento del total. De ganar, se podría hablar de un continuismo, un tercer gobierno en línea encabezado por la política vallecaucana, algo poco visto a nivel regional a excepción de la Costa Caribe con los clanes Char, Gnecco; o en el Tolima, con los Barreto.De acuerdo con el informe ‘Precandidatos cuestionados elecciones regionales – Junio 2023’ de la Línea Democracia y Gobernabilidad de la Fundación Paz y Reconciliación (Pares), Dilian Francisca Toro puso en las elecciones al Congreso de la República del 2022 a dos senadores y cuatro representantes a la Cámara, convirtiéndose en el segundo clan político más importante del país.(Le puede interesar: Así fue la explosión que hace 67 años marcó el renacimiento de Cali). El consultor y estratega político Álvaro Benedetti explica que el movimiento creado por Dilian Francisca Toro conocido como ‘Nueva Generación’ es parte de un caudal electoral que viene cultivándose desde los años 90, cuando el notario tercero de Cali, su cuñado Jorge Caicedo, le dio una importante fuerza electoral que le ayudó a escalar. “En efecto, este sería el tercer gobierno en línea de un proyecto que se ha ido consolidando con los años –explica Benedetti–. Desde entonces han sabido tejer esas alianzas en el sur y centro del Valle con políticos locales y descendientes de décadas atrás. Digamos que en relación con el movimiento ‘Nueva Generación’ y el aval de ‘La U’, estamos ad portas de un tercer periodo”.El experto señala que esta popularidad de Toro en el Valle del Cauca se debe a un voto de estructura, lo que se conoce tradicionalmente como maquinaria política. Dilian Francisca Toro cuenta con un tercio de los alcaldes que en estos momentos tiene el Valle del Cauca, una región de 42 municipios. Además de eso, hace cuatro años fue una aliada política de Jorge Iván Ospina en Cali, donde también cuenta con algunos “arreglos burocráticos”.Este poder político comienza en Guacarí, centro del Valle, donde el clan político de la familia Toro le permite a Dilian Francisca comenzar su carrera política como concejala (1984 – 1988), fue alcaldesa de este municipio (1992 – 1994) con el aval del partido Liberal y el apoyo de Carlos Herney Abadía, condenado en 1998 en el marco de las investigaciones del Proceso 8.000. Para 2002, Toro, quien es médica cirujana de la Universidad Libre de Cali especializada en medicina interna y reumatología de la Universidad Federal de Río de Janeiro, fue elegida senadora por el mismo partido con un total de 71.721 votos.El informe de la Fundación Pares resalta que fue en 2006 cuando Dilian Francisca Toro empezó a forjar su capital político.En aquel año, la entonces senadora fue expulsada del liberalismo por apoyar la reelección del expresidente Álvaro Uribe. Ahí decide hacer parte de los fundadores del partido de ‘La U’. En ese año fue la senadora más votada, además fue elegida presidenta del Senado, cargo que ocupó hasta julio de 2007.En el Congreso estuvo hasta febrero de 2013, cuando tuvo que renunciar para enfrentar un proceso judicial por la indagación de la Corte Suprema de Justicia por presunto lavado de activos, al haber adquirido unos predios que resultaron ser del líder del Cartel del Norte del Valle Víctor Patiño Fómeque, alias La Fiera. Durante aquel proceso, se le dictó medida de aseguramiento preventiva. Sin embargo, quedó en libertad después de pagar una fianza. (Lea también: Martín Contreras, el hombre que luchó contra un tiburón y vivió para contarlo). Luego de las destituciones de Juan Carlos Abadía y Héctor Fabio Useche, y la elección atípica de Ubéimar Delgado, el Valle del Cauca afrontaba la figura de la Ley 550 y no era un departamento que garantizara inversión o atravesara un momento de crecimiento relevante. En ese momento aparece Dilian Francisca Toro en el panorama regional con el aval de ‘La U’. En octubre del 2015 fue elegida con el 35 por ciento de los votos como la primera mandataria del departamento. Benedetti sostiene que una de las razones de la popularidad de Toro se debe a que su gestión le ha permitido al Valle crecer y asegurar más inversión, además de garantizar una continuidad de procesos gracias al gobierno actual de Clara Luz Roldán. “Se ha definido una política territorial –aclara el analista–. Por ejemplo, la promoción de la visión Valle 2032, que empieza con Ubéimar, el Valle es el primer departamento con Plan de Ordenamiento Territorial (POT). Esa visión regional, con todo el sesgo político que pueda tener, ha garantizado que sea un foco de inversión muy importante y un departamento desarrollado. Diría que falta mucho camino, pero el Valle ha dado un salto importante, gústenos o no, seamos afines o no, ha dado un salto grande en comparación con periodos atrás”. Aunque otros académicos y expertos coinciden con el cumplimiento en la gestión de Dilian Francisca Toro y cómo esto puede influenciar en el apoyo masivo de ella o de sus candidatos, el coordinador de investigación en la Fundación Pares, Esteban Salazar, asegura que se trata de un autoritarismo subregional.“Los clanes políticos del país son así –explica Salazar–. A nivel local son redes muy sólidas de cuotas burocráticas y grandes contratos. Es un arraigo fuerte el que tiene y lo más parecido a que voten por ella solo por su gestión es falso, se parecería más a un síndrome de Estocolmo. En estas zonas la alternancia del poder es impensable y existen alianzas con estructuras clientelistas y de gobierno que no permiten que exista una gran competencia”. El experto señala que lo mencionado aplica de igual forma al clan Char en Barranquilla, donde se han visto grandes avances en diferentes temas.“Son eficientes en cumplir con lo que se plantean en temas –cuenta Salazar–. Es un espejismo del ‘roba pero hace’, así haya favoritismos en contratos y otras actitudes que generen preocupación. Se trata de una captura institucional total”. Benedetti asegura que se trata de un gobierno ceñido a la norma, que se preocupa por cumplir indicadores de resultado con base en lo que tiene que ejecutar, pero se trata también del esfuerzo mínimo de gobernar.“Uno no encuentra mayor gestión que suponga un salto cualitativo en potenciar la marca Valle de crecer, de garantizar prosperidad social –considera Benedetti–. Mi opinión frente a su gestión es esa”. Salazar, por su parte, sostiene que este tipo de clanes han pulido durante años sus estrategias, lo que él ha denominado como una “sofisticación de la corrupción”, un escenario en el que es cada vez más difícil encontrar vacíos en los procesos de contratación. (Le recomendamos: El drama de madre en Cali para que autoridades busquen a su hijo desaparecido). Algunos analistas consideran que la presencia de Dilian Francisca Toro en la coalición del Gobierno Nacional le restaría votos ante lo mal parado que se ha visto el Pacto Histórico tanto a nivel nacional como local. No obstante, Esteban Salazar cree que son lógicas diferentes y se trata más de una oportunidad para que esta política demuestre todo su poderío regional. “La imposibilidad del Pacto Histórico de consolidar algo fuerte a nivel regional es una oportunidad para que Dilian juegue con eso –menciona Salazar–. Ella quiere verse más fuerte, esa es su intención. En todo el país se está viendo ese fenómeno de regresar al 2015. Los Char en Barranquilla están en lo mismo, todos los clanes están enfocados en demostrar su poderío regional”.En cuanto a sus relaciones con el poder central, Toro solo tuvo algunos reparos en cuanto a la reforma a la salud, no obstante, nunca tuvo un altercado fuerte y frontal contra el Gobierno Petro, por lo que se le considera estratégica y, señalan expertos, podría haber alianzas territoriales con el Petrismo. En eso coincide Álvaro Benedetti, quien cree que podría haber una alianza de la centro derecha en el Valle del Cauca con el fin de hacer contra peso a la exgobernadora. Los expertos coinciden en el emporio político que ha forjado la ‘Baronesa de Guacarí’, pues en la actualidad son ocho los alcaldes apoyados por ella y hay ya seis candidatos a las alcaldías de Tuluá, Guacarí, Sevilla, El Águila, Calima el Darién y Cartago bajo su sombra. “Dilian no tiene contrapeso –aclara el investigador de Pares– . Clara Luz Roldán llegó con una de las votaciones más altas, ese es su poder y quiere demostrarlo de nuevo”.En el 2008, según el informe de Pares, la Corte Suprema de Justicia le abrió una investigación preliminar por un presunto beneficio recibido de la presión de grupos paramilitares para las elecciones en el Valle. Sin embargo, en el 2018, la Corte archivó la investigación debido a que no existían pruebas suficientes.En la actualidad, Toro aparece demandada en 16 procesos de carácter privado y también existe un proceso abierto en la Corte Suprema. MIGUEL ÁNGEL ESPINOSA BORRERORedactor de EL TIEMPONACIÓNEn Twitter: @Leugim40|https://www.eltiempo.com//files/article_vertical_content_new/uploads/2023/04/24/64471f8f06bfc.png
Inseguridad en Santa Marta: gremios hacen llamado por afectaciones al turismo|"
Delincuentes tienen azotados a habitantes y turistas en Santa Marta."|18 de agosto 2023, 01:04 P. M.|Santa Marta, una de las joyas turísticas de la región Caribe, ha perdido su tranquilidad a manos de la inseguridad. La creciente ola de robos y asaltos, perpetrados por delincuentes en motocicletas armados, ha dejado a ciudadanos y visitantes alarmados y desesperados.(Lea también: Playas prohibidas: ciudadanos exigen recuperar su derecho al mar en Pozos Colorados)Cada día, denuncias y videos de cámaras de seguridad revelan cómo los delincuentes atacan sin piedad en calles, restaurantes y negocios, sin importar la hora ni el lugar. Las autoridades locales luchan por frenar este flagelo, pero la astucia de los ladrones prevalece. A menudo, aprovechan distracciones para cometer robos y no dudan en utilizar la violencia. La situación ha llegado a un punto crítico, con turistas siendo víctimas de actos criminales. En un incidente reciente, dos mujeres fueron arrestadas por robar a un turista en el Parque de los Novios.Según la información proporcionada por el visitante, quien es del interior del país, una de las mujeres supuestamente golpeó su bolsillo hasta que logró sacar su billetera, mientras que la otra esperó a que cayera al suelo para recogerla y salir del lugar.Sin embargo, la presencia de miembros de la Unidad de Espacio Público (Udep) fue vital para evitar que las mujeres, que aparentemente estaban bajo la influencia de drogas, lograran su objetivo.El problema se ha extendido a los destinos turísticos emblemáticos como El Rodadero, Taganga y el Centro Histórico. Incluso una influenciadora reconocida, Sara Samaniego, fue robada a plena luz del día cerca de la Playa Salguero. El hecho quedó registrado en video por una cámara de seguridad, que la misma creadora de contenido compartió en sus redes sociales, donde se observa cuando la mujer va ingresando al hotel y detrás de ella aparece un hombre con camiseta roja.Este último forcejea con ella, mientras le arrebata el bolso que llevaba y luego escapa con las pertenencias de la joven.Otro caso de hurto lo reportó un turista brasileño a quien con una llave maestra le sacaron dinero y pertenencias que dejó guardada en un vehículo que rentó y que había dejado parqueado en una calle del Centro Histórico. La Fiscalía General de la Nación por estos días investiga un robo en un grupo de turistas que disfrutaba de un paseo en lancha por la Ciénaga Grande. Entre los afectados hay visitantes de España y también colombianos, quienes tuvieron que entrar sus pertenencias ante la incursión de hombres fuertemente armados a la lancha que les hacía el tour.Los atracadores se llevaron todos los elementos de valor y hasta el motor de la lancha, dejando a los turistas a la deriva.Ómar García, representante del comité de hoteleros (Cotelco), capítulo Magdalena, señaló que el tema es preocupante y está afectando muy fuerte la imagen de Santa Marta.“Los hoteleros y el gremio turístico al igual que la Alcaldía se esfuerzan por vender a Santa Marta como un extraordinario destino turístico, pero no hay duda que estos hechos de inseguridad alejan al foráneo”, manifestó. García señala que hacen falta acciones más contundentes para aumentar la seguridad, especialmente en los sitios turísticos en los que el alto tráfico de personas es aprovechado por los ladrones.“Taganga es un pueblo pequeño y todos saben quiénes son los que hacen daño a los turista, sin embargo, nadie hace nada. Nosotros íbamos caminando por Playa Grande y nos robaron. Posteriormente un lanchero se nos acercó y dijo que podía ayudarnos a recuperar nuestras pertenencias si le dábamos recompensa. (…) Consideramos que es una mafia completa que opera en este paradisíaco lugar”, contó un turista bogotano que fue victima de delincuentes. Los líderes empresariales, junto con las autoridades y la sociedad civil, reconocen que la seguridad es fundamental para el desarrollo de la región.El comité intergremial del Magdalena se pronunció a través de un comunicado de prensa con soluciones integrales, que incluyen un aumento en la presencia policial en áreas de alto riesgo, instalación de cámaras de seguridad estratégicas y programas de prevención del delito.“Como líderes empresariales, asumimos la responsabilidad de trabajar en conjunto con las autoridades y la sociedad civil en la búsqueda de soluciones efectivas”, señala.El Comité reiteró su rechazo contra las acciones delincuenciales y criminales que se han presentado en el territorio en contra de los habitantes y visitantes, hechos que han afectado directamente al sector productivo, las actividades turísticas, así como la inversión, el orden público y la tranquilidad de la ciudadanía. Ante la creciente preocupación por la inseguridad en Santa Marta, la Policía Metropolitana ha emitido una serie de recomendaciones fundamentales para los turistas que desean disfrutar de la ciudad sin exponerse a riesgos innecesarios.Entre las medidas están mantener la distancia y evitar interacciones innecesarias con personas que no sean de confianza es esencial. igualmente, en la medida de lo posible, caminar en grupo o con compañía durante la noche. Los lugares solitarios pueden ser un blanco fácil para los delincuentes.(Además: Polémica en Santa Marta por posible prórroga de concesión de terminal de hidrocarburos)Por otra parte, a la hora de hacer compras, buscar establecimientos reconocidos y autorizados. Señalan que es importante evitar adquirir productos en vendedores ambulantes o mercados informales, ya que estos lugares pueden ser más susceptibles a la delincuencia.Finalmente, hizo un llamado a los visitantes a conocer las regulaciones locales. Esto incluye los horarios de cierre de establecimientos y las restricciones en áreas específicas. ROGER URIELESPara EL TIEMPOSANTA MARTAEn Twitter: @rogeruv|https://www.eltiempo.com//files/article_content_new/uploads/2023/08/18/64dfae1a1d12d.jpeg
Masacre en Antioquia: autoridades confirman el asesinato de 4 hombres en Cáceres|"
Líder social de vereda San Pablo, entre las víctimas. Defensoría dice que se consumaron riesgos."|25 de agosto 2023, 01:19 P. M.|"Fuentes del Ejército Nacional le confirmaron a EL TIEMPO que cuatro hombres fueron asesinados en la vereda San Pablo de Cáceres, en el Bajo Cauca antioqueño. En la zona se registró en los últimos días una incursión armada por parte de las Autodefensas Gaitanistas de Colombia que confinó a los habitantes de la remota población. (Lo invitamos a leer: Ejército verifica incursión armada de Agc que habría dejado 6 muertos en Antioquia)La Corporación Comité de Derechos Humanos Jesús María Valle denunció este jueves, 24 de agosto, que el ataque de hombres armados en la zona había dejado, por lo menos, 6 personas fallecidas. Sin embargo, la información no había podido ser verificada por las autoridades debido a los enfrentamientos que se presentaron en las últimas 36 horas. Entre las víctimas del ataque, según informó la Defensoría del Pueblo, figura el líder social y comunitario Luis Miguel Echavarría, presidente de la Asociación de Barequeros de San Pablo, así como otros miembros de la comunidad.""Al momento la información oficial que tenemos del Ejército es que se ha hecho el hallazgo de cuatro cadáveres. Uno de ellos está identificado, lo otros no han sido identificados todavía. El cuerpo de Luis Miguel Echavarría está cerca del caserío, los otros tres están más alejados"", aseguró el gobernador de Antioquia, Aníbal Gaviria, en la tarde de este viernes. (Le puede interesar: Estructuras criminales de Medellín aseguran que no hay ningún veto a candidatos)El mandatario explicó que las informaciones han sido confusas y de diferentes fuentes, pero la presencia del Ejército en la zona permitió concretar los datos de lo sucedido. Al mismo tiempo, Gaviria confirmó que, por tratarse de un homicidio colectivo, la investigación será asumida por una fiscal especializada que se desplazó desde Bogotá para ponerse al frente del caso. Según se ha dado a conocer, los hombres armados de las Agc habrían impedido la salida y entrada de la población ubicada a más de cuatro horas de la cabecera municipal entre la noche del miércoles y la mañana del jueves. El cuerpo del líder no había podido ser evacuado de la zona, debido a las restricciones de movilidad que se impusieron. Los defensores de derechos humanos denunciaron incluso que el cadáver fue objeto de alimento de aves carroñeras en la calle principal de San Pablo.(Además: El poderoso armamento que le incautaron a banda criminal que genera zozobra en Manrique)Uniformados de la Fuerza de Tarea Conjunta Aquiles del Ejército Nacional fueron desplegados en la zona para verificar la situación de orden público y proteger a la población civil. Sin embargo, a su llegada, los soldados fueron atacados con disparos de fusil por parte de actores armados. Hasta la noche del jueves los pobladores de San Pablo seguían confinados en la escuela de la vereda y con acceso restringido a alimentos, advirtió la Defensoría.""El hostigamiento ya ha terminado y las tropas de la Séptima División permanecerán allí para todos los efectos de la investigación y el acompañamiento a los organismos de justicias, pero también para garantizar la tranquilidad de los pobladores"", agregó el gobernador Gaviria. Una de las versiones que se busca esclarecer en la investigación es un supuesto enfrentamiento entre las Agc o 'Clan del Golfo' contra hombres armados de Eln que también hacen presencia en el territorio. La Corporación solicitó la reacción inmediata del Gobierno Nacional para que se proteja la vida y la integridad de esta población. Al mismo tiempo pidieron a las demás autoridades regionales y locales acompañar la grave situación en la zona y tomar acciones para su protección.Por su parte, el defensor del Pueblo, Carlos Camargo, señaló que con la masacre “se consuman los riesgos advertidos por esta entidad frente a la vulneración de derechos humanos a las comunidades de esta región antioqueña"". La entidad —a través de la alerta temprana 045-2020, 25 oficios de consumación y un informa de seguimiento— había hecho reiterados llamados al Gobierno Nacional. (Consulte acá todas las noticias de Medellín y Antioquia de EL TIEMPO)De hecho, hace tan solo tres semanas la Defensoría advirtió la crítica situación de 33 veredas de Cáceres. ""Lamentablemente, no ha sido atendida con la celeridad que demanda"", dijo el defensor Carlos Carmago, quien reiteró la necesidad de tomar medidas urgentes para proteger a la población del Bajo Cauca antioqueño. MEDELLÍNEscríbanos: sebbol@eltiempo.com"|
Ofrecen hasta $20 millones de recompensa para recuperar guantes robados de Óscar Rivas|"
Gobernadora, Clara Luz Roldán hizo el anuncio a través de redes sociales. "|25 de agosto 2023, 01:59 P. M.|en las últimas horas, la gobernadora del Valle del Cauca, Clara Luz Roldán anunció una recompensa hasta de $20 millones de pesos por información que permita recuperar los guantes que le fueron hurtados al boxeador Óscar Rivas. (También lea: En Ginebra capturan a alias 'El mocho', reconocido actor sicarial y de estupefacientes) Así lo publicó la mandataria de los vallecaucanos a través de redes sociales, en las que también pide a las autoridades adelantar trabajos para devolverle al deportista vallecaucano este elemento de uso personal, el cual fue robado de su automóvil en la noche del jueves 24 de agosto. Cabe recordar que el campeón mundial de boxeo, a través de un video contó que delincuentes en el barrio Ciudad Jardín, mientras realizaba unas grabaciones, le rompieron el vidrio de su vehículo y se le llevaron un maletín en el que llevaba sus guantes. “La verdad que me siento muy afligido por estas cosas que pasan. Hay personas que no saben el valor que tienen las cosas para cada persona”, dijo en un video difundido en redes.(Además: Cayó presunto autor material del crimen de un policía que fue asesinado tras un hurto)El también exparticipante del Desafío The Box comenta que los guantes tienen un valor sentimental. “Las cosas que están dentro de esa maleta tiene un valor muy importante para mí”, agregó.Además, pidió ayuda de la comunidad y de las autoridades para recuperar el bolso.“Esos guantes no tienen ningún valor para esas personas, pero para mí sí lo tienen”, finalizó.CALI|
Nicolás Petro y Day Vásquez comparecieron ante la Fiscalía en Barranquilla|"
La pareja de exesposos sigue colaborando en la investigación que lleva el fiscal Mario Burgos."|25 de agosto 2023, 01:08 P. M.|Bajo un aparatoso esquema de seguridad irrumpió la mañana de este viernes Nicolas Petro en la sede de la Fiscalía de Barranquilla para continuar con su proceso de colaboración con la justicia en torno al proceso de enriquecimiento ilícito y filtración de dineros a la campaña de su padre, el presidente de la República, Gustavo Petro.Puede leer: EE.UU. responde a plan de reconciliación de Petro: seguirá persiguiendo a los narcosEl exdiputado del Atlántico, Nicolás Petro, llegó sobre las 9 am en la Torre Manzur de la Fiscalia,en el Centro de Barranquilla, en dos camiones con escoltas y policías. Su arribo al edificio de la Fiscalía alteró la tranquilidad en la zona, en donde aguardaban algunos periodistas y camarógrafos que se alertaron al ver el movimiento del esquema de seguridad.La diligencia se cumplió ante el fiscal Mario Burgos quien llegó desde Bogota para seguir recibiendo las versiones de Nicolás Petro y su exesposa Daysuris Vasquez, sobre el escandaloso caso de manejo de dineros habrían movido en torno a la campaña y la presunta celebración indebida de contratos con la Gobernación del Atlántico. Cabe recordar que Vásquez compareció la tarde de este jueves en la Torre Manzur de la Fiscalía.Tanto Petro con Vásquez llegaron en medio de su esquema de seguridad en completo silencio.Ambos tardaron unas dos horas dentro del edificio de la Fiscalía. Luego salieron con sus escoltas y camionetas sin decir una palabra a los periodistas que los aguardaban en las afuera de la Torre.|
Este es el cartel de los más buscados en Bucaramanga: ofrecen millonaria recompensa|"
Se trata de 32 temidos y peligrosos delincuentes que las autoridades buscan para evitar homicidios. "|25 de agosto 2023, 08:10 A. M.|"Mediante el plan choque seguridad 360, la Policía de Bucaramanga dio a conocer el el cartel de los más peligrosos y buscados en la ciudad. Son 32 personas las que están siendo investigadas, de las cuales, cuatro ya fueron capturadas en las últimas horas. Puede leer: Cárcel para hombre que mató a su hermana y esposa en Landázuri, esta fue la historiaLas autoridades están ofreciendo entre tres a 50 millones de pesos como recompensa a quien brinde información de los más buscados. El general José James Roa contó que de los cuatro capturados, tres se entregaron a las autoridades. ""Cualquier información que conduzca a la captura de estos delincuentes, se está cancelando entre 3 y 50 millones de pesos, que denuncien en la línea 123, tendremos absoluta reserva"", explicó el general. Melissa Múnera Zambrano Corresponsal de EL TIEMPO - Bucaramanga."|https://www.eltiempo.com//files/article_content_new/files/crop/uploads/2023/08/25/64e8a59a1c9a1.r_1692970191843.0-0-835-468.jpeg
