titular|encabezado|fecha|cuerpo|imagen
El calvario de un gringo por recuperar apartamento que le invadieron en Cartagena|"
Lleva 15 años esperando un fallo. Expediente se lo robaron en juzgado y tuvo que arrancar de cero."|25 de agosto 2023, 01:55 P. M.|"15 años lleva Dennis D’Antonio O’Harie luchando en estrados judiciales colombianos para recuperar un apartamento que compró en el emblemático edificio Pombo, en la Calle del Cuartel del Fijo, del Centro Histórico de Cartagena.(En contexto: La guerra jurídica por una joya arquitectónica de Cartagena)El sueño de Dennis, ciudadano norteamericano, de retirarse después de los 50 años y vivir su vejez en la ciudad más apasionante del Caribe colombiano se convirtió en su dolor de cabeza, y una fortuna gastada en abogados y viajes a Cartagena sin obtener, al día de hoy, una respuesta de la justicia. “No es posible que un caso básico del derecho a una propiedad, con todas las pruebas presentadas y todos los testigos, lleve 15 años y no hallan fallado”, narra vía telefónica Dennis D’Antonio O’Harie, desde Daytona Beach en La Florida, donde reside.Se trata del apartamento 301 en el edificio Pombo: una joya Republicana construida en 1930, y que se levanta en la equina de la Calle de Cuartel del Fijo con la Calle de la Estrella, de la Ciudad Colonial.(En contexto: Denuncian obra ilegal en la terraza de una joya republicana de Cartagena) Dennis recuerda que durante unas vacaciones por el Caribe colombiano, en julio del año 2004, bajó por la calle de la Soledad y tropezó de repente con aquella ‘pintura' arquitectónica en una esquina del Centro Histórico de Cartagena. Quedó hipnotizado por tanta belleza en piedra. Aquella mole de tonos verdes, amarillos y grises, con grandes ventanales y balcones, lo sedujo de inmediato y pensó que querría vivir allí el resto de sus días. Ingresó y caminó por los corredores y grabó en su mente aquellos jardines olvidados del viejo Edificio Pombo.""Era una mezcla de belleza, arquitectura, historia y decadencia. De inmediato me remitió a la obra de Gabo"", dice el extranjero, que entonces pensó que el lugar solo necesitaba remodelación. (En contexto: Montaron una discoteca ilegal en 'joya' arquitectónica de Cartagena) Dennis regreso a Cartagena y compró el apartamento 301 en aquel edificio republicano a Mariano Castañeda Pertuz, en el año 2006, por 80.000 dólares, cuando la divisa estaba a 2.000 pesos. Es decir 160 millones de pesos.“Firmamos papales en notaria y yo estaba muy emocionado y mi proyecto era pensionarme y retirarme a vivir en mi apartamento de Cartagena”, narra Dennis.(Le puede interesar: Las mujeres que cultivan mangle para salvar a la Ciénaga de la Virgen en Cartagena)Lo que no sabía este gringo viajero- enamorado de Colombia- y de voz pausada era que el edificio, ubicado en el corazón de un patrimonio de la humanidad, escondía una tragedia legal y una guerra interna entre propietarios y poseedores de años, con una larga lista demandas y juicios sobre varios apartamentos, que es muy bien conocida por jueces y abogados en los juzgados del Cuartel del Fijo, paradójicamente ubicados en la misma calle del edificio. Dennis tenía que regresar a su trabajo en los Estados Unidos, así cerró su apartamento y se marchó confiado a su país.Ilusionado viajaba a Colombia de cuando en cuando para visitar el que sería su hogar.“Los vecinos que viven en el segundo piso pueden verificar y son testigos de mi presencia varias veces durante esos años”, dice.(Vale la pena leer:  Cartagena: balean dentro de su camioneta a conocido empresario de barcos)En febrero del año 2008 Dennis contrató los servicios del abogado Orlando Flórez para que visitara semanalmente el apartamento y estuviera al frente del pago a la administración. Sin embargo, en abril de 2009, Flórez, un hombre honesto, le informó que las chapas sido violadas y cambiadas. Desde entonces el apartamento fue ocupado por Electo Cáliz Fernández, administrador del edificio, quien reclama antigüedad sobre el bien desde hace más de dos décadas.En diálogo con EL TIEMPO, este hombre asegura que llegó al edificio Pombo en la década de los 80, cuando estaba abandonado.(Lo invitamos a leer: Candidato a la alcaldía de Cartagena pide declarar impedido a Dau durante elecciones)“Era un nido de ratas, basurero y hogar de indigentes. Cuando nadie daba un peso por el Centro Histórico de Cartagena y menos por este edificio. Yo lo recuperé a pulso”, dice Cáliz Fernández, quien asegura que poco a poco y a pulso recuperó esta joya Republicana.Cáliz Fernández, que ocupa varios apartamentos en el edificio, hoy usufructúa el apartamento 301 y lo arrienda para turistas balo la modalidad de Airbnb.Según la tradición del apartamento, en la década de los 70 su propietario era Pedro Ganem, dueño de todo el edificio Pombo. Luego pasó a manos de Matilde Stambulie de Ganem, su esposa, quien finalmente lo vendió al abogado Rodrigo Manotas Trujillo.El 31 de mayo del 2002 fue embargado al abogado Manotas Trujillo y en remate por juzgado lo adquirió Mariano Castañeda Pertuz, quien luego, en el año 2006, se lo vendió al extranjero. A comienzos de los años 20 del siglo pasado, dos casonas coloniales ubicadas en la calle del Cuartel fueron demolidas para dar paso al hermoso edificio que ocupa 1.400 metros cuadrados- prácticamente una manzana entera-. Había sido construido por la Sociedad Pombo Hermanos.La obra fue finalizada en el año de 1929 y para la época fue una de las más cotizadas de la ciudad.(Le puede interesar: Atención: hostigamiento con explosión contra base militar en Santander de Quilichao)En 1949 el predio pasó a manos de una Sociedad conformada por los esposos Pedro y Matilde Ganem, de origen libanés. Pero en 1966 fue vendido como propiedad horizontal para oficina de nacientes comerciantes y abogados.Apellidos prestantes del Caribe abrieron oficinas en el edificio Pombo y llegaron compradores incluso desde Barranquilla.Pero en la década de los 70, cuando nadie daba un peso por el Centro Histórico y muchas casonas fueron abandonadas, y el edificio Pombo también cayó en desgracia. Durante muchos años fue ocupado por vendedores informales que usaban los corredores y apartamentos decadentes para guardar mercancías. Fue el hogar de habitantes de calles y eran constantes los allanamientos de la policía.Para entonces Cartagena aún no había sido declarada Patrimonio de la Humanidad por la Unesco, y solo hasta la década de los 80 el Gobierno miro hacia esa ciudad rodeada por una muralla en roca y vio que había un potencial.El edificio Pombo, bien cuidado y administrado debidamente,  nada tendría que envidiarles a complejos históricos como el convento de las Clarisas en el barrio San Diego, donde opera el Hotel Santa Clara; o el mismo Hotel Charleston Santa Teresa, que fue cárcel y hospital.Cuenta con amplios corredores, escaleras y balcones que dan a dos patios centrales que alguna vez fueron jardines primaverales, y después basurero. El 27 de mayo del 2009, con autorización de Dennis, el abogado Orlando Flórez elevó la primera demanda en este caso contra Electo Cáliz Fernández por haber violado las chapas sin ser el propietario.En junio del año 2010 Dennis regresa a Colombia, y contrata abogados civil y penal, para recuperar el apartamento y para elevar demanda contra el administrador del edificio.Pasaron tres años y el proceso estaba en el olvido en las gavetas del juzgado séptimo de Cartagena.(Vale la pena leer: Mujer fue atacada a tiros por su exesposo, días antes había denunciado amenazas)En enero del año 2013 Dennis aterrizó por vigésima vez en Cartagena de Indias y se enteró de que el proceso en los juzgados del Cuartel del Fijo se los había robado.Los argumentos del despacho judicial fue un robo de madrugada en el cual, extrañamente, no se perdieron computadoras ni otros objetos de valor. Dennis D’Antonio O’Harie se armó de paciencia e inició una nueva demanda, en la cual ha sido estafado por abogados.“Cuando Electo tomó posesión de mí apartamento lo denuncié. Mi demanda pasó al juez 13 pero Electo no respondió a la demanda a tiempo y prácticamente perdió ese caso. Al verse perdido, con su abogado, fueron y presentaron otra demandada”, dice el extranjero.El Juez 13 de Cartagena, que no ha fallado el caso desde hace 15 años, es Mauricio González, conocido en el país porque además es pastor cristiano y se negó casar por lo civil a una pareja de gay.(Lo invitamos a leer: Vehículos de carga no pagarán peaje en la vía al Llano durante el fin de semana)El fallo que estaba programado para el pasado 15 de junio y fue aplazado para la última semana de agosto, pero Dennis ya está cansado de las innumerables veces que le han anunciado fecha de fallo, pero los jueces siempre aplazan. En el edificio Pombo hay una docena de demandas y litigios por apartamentos ocupados, la mayoría esperando el fallo de un juez. John MontañoCorresponsal de EL TIEMPOCartagena"|https://www.eltiempo.com//files/article_content_new/uploads/2023/08/25/64e8d42872f99.jpeg
¿Cómo transformar los datos del personal en decisiones estratégicas?|"
People Analytics permite gestionar el talento humano de una organización."|23 de agosto 2023, 08:35 A. M.|Hoy se debe reconocer que los ecosistemas laborales que han evolucionado gracias a la digitalización, han facilitado, entre otras cosas, el acceso a una gran cantidad de data sobre las personas que hacen parte de las empresas, y una de las metodologías más usadas actualmente para este propósito es 'People Analytics'. Según Andrés Garzón Lozada, gerente de Selección y Operaciones Internas de Compensar, reconocida entre las mejores empresas para trabajar en el país, el principal objetivo de la ‘analítica de personas’ es utilizar la información disponible para tomar decisiones más informadas, predictivas y alineadas con los objetivos estratégicos de las organizaciones, desde el reclutamiento hasta la retención y el desarrollo profesional. En línea con ello, de acuerdo con diferentes estudios, las organizaciones que implementan estrategias basadas en People Analytics han reportado mejoras de hasta un 30 por ciento en sus procesos de selección, retención y formación del talento humano. En palabras de Garzón Lozada, la analítica de personas es un concepto que viene creciendo en uso y adopción, jugando un papel fundamental en el presente y futuro de las divisiones de personal de las compañías, a fin de abordar y desarrollar el conjunto de retos estratégicos que se presentan en contextos laborales cada vez más complejos. Así las cosas y por mencionar un ejemplo, uno de los principales desafíos de las organizaciones es el fenómeno de la fuga de talento, que hace referencia a la rotación de personal altamente calificado, migración que no solo afecta su productividad inmediata, sino que también puede tener repercusiones a largo plazo en su viabilidad, en la medida que conlleva sobrecostos económicos relacionados con el reclutamiento y la capacitación de los nuevos empleados, además de afectar la cohesión de equipos, la transferencia de conocimiento y el clima organizacional Conforme con un estudio desarrollado por la plataforma LiveCareer, el trabajo remoto sería una de las causas principales de este fenómeno, asegurando que alrededor del 29 por ciento de los profesionales en el mundo renunciarían a su trabajo debido a la presencialidad obligatoria. En este contexto, la implementación de metodologías de People Analytics se presenta, entre otras cosas, como una herramienta para anticiparse a las causas subyacentes de la rotación, identificando patrones y variables de riesgo para diseñar intervenciones efectivas, de manera que, en lugar de reaccionar ante la rotación, las organizaciones puedan actuar proactivamente, generando un entorno laboral más atractivo y retentivo. Continuando con el gerente de Selección y Operaciones Internas de Compensar, desde el 2022 esta organización ha venido trabajando en la implementación de varias herramientas apoyadas en el uso de la ciencia de datos para la gestión del recurso humano, lo que les ha permitido avanzar en el desarrollo de prototipos de modelos predictivos para dar respuesta a preguntas esenciales, asociadas a la retención y promoción de los colaboradores y, en esa misma línea, relacionadas con su bienestar. “Esta apuesta nos permitirá entre otras cosas seguir dándole valor a lo que sin duda es el mayor de nuestros activos, porque por encima de las cifras duras siempre estará nuestro interés genuino por las personas, que debe ser en últimas el fin del uso de cualquier tecnología”, aseguró Garzón Lozada. Y es que dice el experto, llegar a altos niveles de evolución en los modelos de analítica de personas en los departamentos de Talento Humano no es una tarea sencilla, más aún si se tiene en cuenta que en la mayoría de las empresas los profesionales de estas áreas no tienen la formación requerida para implementar y administrar este tipo de herramientas. Pese a ello, advierte que trasladar dichos análisis de forma exclusiva a las áreas de analítica tampoco es lo recomendable puesto que se requieren conocimientos para interpretar y darle sentido a la información que arrojan los modelos relacionados con variables y comportamientos humanos, por esto aconseja contar con equipos interdisciplinarios para garantizar que los resultados se utilicen de manera responsable y efectiva en beneficio de la organización y los colaboradores. “Nosotros comenzamos con un enfoque básico de Business Intelligence (BI), organizando nuestra data para comprender el pasado. Ese primer paso nos brindó la base para evolucionar hacia metas más ambiciosas y, por ejemplo, actualmente, con nuestro modelo de Machine Learning, esperamos reducir el índice de rotación en un cinco por ciento, que, aunque está por debajo del promedio, siempre será un reto de cara a la optimización de resultados”, puntualizó. Para finalizar, instó a las áreas de recursos humanos a analizar y utilizar sus datos de forma integrada, promoviendo el abordaje de las problemáticas propias con una visión estratégica, para que las iniciativas y planes de trabajo que se originen tengan alcances de gran relevancia, yendo a la raíz del problema. “Estamos convencidos de que solo esta forma de operar responde a las demandas de la alta dirección, al cumplimiento de la propuesta de valor y, por si fuera poco, contribuye a la generación de ambientes laborales atractivos e incluyentes que aportan al bienestar integral de nuestros trabajadores”, concluyó Andrés Garzón Lozada, gerente de Selección y Operaciones Internas de Compensar|
En El Calvario, Meta, seis casas colapsaron y 70 más resultaron afectadas|"
El municipio del Meta sigue incomunicado por los deslizamientos de tierra de hace 30 días."|18 de agosto 2023, 09:15 A. M.|Muy compleja es la situación que viven los 2.000 habitantes de El Calvario, en el Meta, epicentro de los movimientos telúricos más fuertes de las últimas horas, y por los deslizamientos que provocaron las lluvias el pasado 17 de julio, que tienen la población incomunicada. El alcalde Wilson Alférez señaló que tiene un reporte de seis casas colapsadas y 70 más con afectaciones y sigue recibiendo reportes, con el propósito de tener un consolidado de la situación de todo el municipio, enclavado en la cordillera Oriental, cuya mayor parte de la población vive en zonas rurales. Las mayores concentraciones de población están en el área urbana, con unos 600 habitantes y en los centros poblados de San Francisco y Monfort y gran parte de las casas son construcciones antiguas construidas en bahareque, que no cumplen las normas de sismo resistencia, son las que mayores afectaciones tuvieron por los movimientos telúricos. Le puede interesar: Así fue la explosión que hace 67 años marcó el renacimiento de CaliLa otra gran dificultad, dice el mandatario, es que el municipio sigue incomunicado por sus cuatro vías de comunicación terrestre, tras los derrumbes que se presentaron sobre las vías hace un mes, pese a los trabajos que se adelantan con maquinaria amarilla pequeña, de su municipio, el trabajo de la comunidad y de los equipos que llegaron para para apoyarlos de la gobernación del Meta. Aseguró que en este momento la mayor preocupación se presenta por la situación de los habitantes de la vereda San Bernardo, en donde casi ni a pie se puede llegar y la familia de la señora Carmelita García, de más de 60 años y quien vive sola, está pidiendo ayuda para poderla evacuar hacia Acacías, también en el Meta. Alférez afirmó que espera concluir de consolidar la información sobre las afectaciones, por los sismos, para presentar un informe a los gobiernos Nacional y del Meta, con el propósito de empezar a recibir las ayudas para las familias y sus municipios lo más pronto posible. NELSON ARDILA ARIAS PARA EL TIEMPO VILLAVICENCIO|https://www.eltiempo.com//files/article_content_new/uploads/2023/08/18/64df7caee10d1.jpeg
Cerrarían nuevamente puente Barragán entre Quindío y Valle|"
Alcalde de Caicedonia pidió que las obras se inicien luego de la reapertura del puente El Alambrado."|18 de agosto 2023, 11:34 A. M.|El puente Barragán ubicado entre el sur del Quindío y el norte del Valle del Cauca, volvería a cerrarse, pero esta vez debido a que se tendría que demoler uno de los pilotes que lo sostienen. El puente solo lleva un mes operando luego de que estuvo fuera de servicio durante nueve meses. El alcalde del municipio de Caicedonia, Valle, Carlos Alberto Orozco, reveló que, durante una visita de un grupo de expertos y el contratista de las obras de reparación, se conoció que se tendrá que derribar una de las bases del puente como solución definitiva.“Nos acaba de notificar el ingeniero experto en puentes que hay que demoler una de las pilas, es muy grave porque al demoler se tiene que suspender obviamente la movilidad entre estos departamentos. Le he pedido a los ingenieros y a la gobernadora que lo hagan, pero cuando abran el otro puente (El Alambrado) para que puedan trabajar tranquilos porque no podemos volver a tener dos puentes cerrados”, dijo Orozco. Le puede interesar: Así funciona el poder político de Dilian Francisca Toro en el Valle del CaucaEl mandatario añadió que la próxima semana se realizará una mesa técnica en Cali y les informarán cuánto tiempo durarán las obras que se tienen que efectuar.“Yo me imagino que se puede demorar un mes, pero mientras eso tendríamos el otro puente ya habilitado. Queda uno un poco aburrido porque dicen que la única forma para darle una solución definitiva es demoler una de las pilas completas, es muy grave y complejo esto”, señaló el alcalde.Y pidió que estas nuevas obras que se iniciarían en unas semanas se realicen con más celeridad. Lea también: Panorama del hurto de motocicletas en Colombia: ¿sabe cuáles son las que más roban?“Le pido el favor al Gobierno Nacional que sea más acelerado esto porque no podemos seguir así, cuántos meses llevamos con este puente cerrado, ha sido una lucha con esto”.Cabe recordar que esta estructura sufrió graves afectaciones durante el invierno de finales del año pasado y más de 80.000 habitantes de la zona estuvieron afectados por nueve meses. Las obras tardaron cinco meses en iniciar y otras cuatro en desarrollarse.Solo hasta el 24 de julio pasado se dio la apertura para automóviles livianos, buses de servicio público de hasta 21 pasajeros y camiones con un peso máximo de 17 toneladas. La velocidad máxima autorizada es de 20 kilómetros por hora y se estableció un pare y siga regulado por agentes de tránsito. LAURA SEPÚLVEDA Para EL TIEMPOARMENIA|
Un impulso al empoderamiento femenino en el comercio ferretero|"
La tienda 18 de Mundial de Tornillos®, la marca colombiana, será atendida únicamente por mujeres."|25 de agosto 2023, 08:57 A. M.|Mundial de Tornillos® abre su nueva tienda en Paloquemao, el centro comercial de cielos abiertos más grande de Colombia, con una inversión de aproximadamente cinco mil millones de pesos. La empresa busca impulsar su plan de crecimiento y ha apostado por el empoderamiento de las mujeres en el ámbito empresarial del comercio ferretero y de la construcción. Con esta inauguración, Mundial de Tornillos® busca fortalecer su presencia en Paloquemao, Bogotá, conocido como el corazón ferretero de Colombia. La empresa busca ofrecer un servicio más ágil y cómodo, priorizando las entregas inmediatas. “Los objetivos y metas que tenemos establecidos para esta tienda son poder ampliar la participación de mercado que tenemos en la zona industrial más importante de Latinoamérica que es Paloquemao. Allí buscamos unas ventas mucho más rápidas, una atención express y vamos a tener mayor exhibición de herramienta”, explicó Julián Cardona Marín subgerente de Mundial de Tornillos®. Esta nueva tienda, la número 18 de la marca en el país, cuenta con un formato exprés de 400 metros cuadrados y una exhibición de herramientas en Show Room. La característica más notable de este nuevo punto de venta es que será administrado exclusivamente por mujeres, lo cual se alinea con los esfuerzos mundiales para promover la igualdad de género y el empoderamiento de las mujeres en el ámbito empresarial. “En un sector que ha sido tradicionalmente muy machista, pero en el cual también vemos participación de las mujeres en diferentes cargos y posiciones en todas las áreas, desde bodega hasta gerentes, y esto es precisamente lo que queremos fomentar, la participación de ellas, darles ese espaldarazo y mostrar el papel tan importante que podemos desempeñar teniendo más mujeres en el sector ferretero”, agregó Cardona. La apertura de esta tienda no solo trae consigo una nueva opción para los consumidores, sino que también envía un mensaje de cierre de brecha de género en el ámbito laboral en el rubro de la economía. La empresa busca equiparar los puestos de trabajo y las oportunidades salariales. El personal femenino de esta tienda se encuentra capacitado para brindar el mejor asesoramiento técnico y recomendaciones a los clientes para encontrar las soluciones adecuadas para sus proyectos. Se espera que esta tienda sea la mejor calificada en atención por parte de los usuarios. En ese sentido, el sugerente de la compañía expresó que, “vamos a tener una atención mucho más ágil, con conocimiento de expertas, un equipo altamente competitivo que entiende, que escucha, que asesora profesionalmente a un nivel diferente y también genera más simpatía, generando una experiencia de compra mucho más agradable, cercana y eficiente”. Es importante recordar que, la marca Super Tools®, propia de Mundial de Tornillos®, también tendrá un espacio protagónico en esta nueva tienda. La empresa ha ampliado su portafolio de herramientas, convirtiéndose en uno de los jugadores más importantes en esta categoría en Colombia. “Los planes de expansión de nuestro negocio buscan que la compañía se posicione con líneas en tornillería inoxidable y también como un referente en la venta de herramientas como equipos de soldadura, abrasivos, penetrantes, lubricantes y todo tipo de sistemas de fijación como brocas, un portafolio de la mejor calidad a un precio justo”, concluyó Cardona. Vale la pena recalcar que, Mundial de Tornillos® abrirá próximamente una nueva tienda en Pereira, eje cafetero. La apertura de esta nueva tienda representa la consolidación del plan de expansión nacional de la compañía, que continuará en el Eje Cafetero en el segundo semestre. Mundial de Tornillos® espera seguir creciendo y posicionándose en el mercado gracias a su amplio catálogo de herramientas y su compromiso con la igualdad de género en el ámbito laboral.|
